{
  "id": "math_sum_evens",
  "title": "Sum of two even natural numbers is even (reference slice)",
  "authors": [
    "Scientific Memory contributors"
  ],
  "year": 2024,
  "domain": "mathematics",
  "source": {
    "kind": "pdf",
    "path": "corpus/papers/math_sum_evens/source/source.pdf",
    "sha256": "e3b0c44298fc1c149afbf4c8996fb92427ae41e4649b934ca495991b7852b855"
  },
  "artifact_status": "admitted",
  "first_artifact_at": "2026-03-18T15:13:12Z"
}