{
  "id": "langmuir_1918_adsorption",
  "title": "The Adsorption of Gases on Plane Surfaces of Glass, Mica and Platinum",
  "authors": ["Irving Langmuir"],
  "year": 1918,
  "domain": "chemistry",
  "abstract": "Equilibrium adsorption on plane surfaces.",
  "tags": ["adsorption", "surface science"],
  "source": {
    "kind": "pdf",
    "path": "corpus/papers/langmuir_1918_adsorption/source/source.pdf",
    "sha256": "e3b0c44298fc1c149afbf4c8996fb92427ae41e4649b934ca495991b7852b855"
  },
  "artifact_status": "in_progress"
}
